,model,method,scaler,import,rmse,r2_score,explained_variance,AUC,accuracy,recall,precision,f1,training_time
0,Random Forest Regressor,RandomForestRegressor,StandardScaler,from sklearn.ensemble import RandomForestRegressor,656.161996914271,0.9729160595082101,0.9732725537144375,,,,,,1.9700400829315186
1,Gradient Boosting Regressor,GradientBoostingRegressor,StandardScaler,from sklearn.ensemble import GradientBoostingRegressor,854.421225651053,0.9540766288983386,0.9543283971452818,,,,,,4.1574647426605225
2,Support Vector Machine Regressor,SVR,StandardScaler,from sklearn.svm import SVR,3225.0912824257994,0.3457048120047467,0.4369006886440753,,,,,,75.75352025032043
3,K-Nearest Neighbors Regressor,KNeighborsRegressor,StandardScaler,from sklearn.neighbors import KNeighborsRegressor,815.5260958035593,0.9581625285925384,0.9581736363463937,,,,,,0.0
4,Decision Tree Regressor,DecisionTreeRegressor,StandardScaler,from sklearn.tree import DecisionTreeRegressor,888.0794892763072,0.9503872405127395,0.9506490829500494,,,,,,0.30547451972961426
5,Lasso Regression,Lasso,StandardScaler,from sklearn.linear_model import Lasso,1136.7083169227876,0.9187192356834923,0.9187896417158334,,,,,,0.6704130172729492
6,Ridge Regression,Ridge,StandardScaler,from sklearn.linear_model import Ridge,1136.8427019503656,0.9187000160415464,0.9187704220738876,,,,,,0.01928114891052246
